peak_id,peak_name,host_contries,height_m,height_ft,location,region,climb_status,is_open,is_unlisted,is_trekking,trek_year,first_asc_yr,first_asc_season,first_asc_date,countries,first_summiters
JOBO,Jobo Rinjang,Nepal only,6778,22238,Rolwaling,Khumbu-Rolwaling-Makalu,Climbed,1,0,0,0,2009,Spring,Apr 22,USA,"Joe Puryear, David Gottlieb"
JOMS,Jomsom Himal,Nepal only,6335,20784,Damodar,Annapurna-Damodar-Peri,Climbed,1,0,0,0,2003,Autumn,Nov 04,"France, Nepal","Hugues De Varax, Yves Exbrayat, Frederique Gaume, Paulo Grobel, Mingma Temba Sherpa"
JONG,Jongsang,"Nepal, China & India",7462,24482,Jongsang,Kangchenjunga-Janak,Climbed,1,0,0,0,1930,Spring,Jun 03,"Germany, Austria","Hermann Hoerlin, Erwin Schneider"
JUNC,Junction Peak,Nepal only,7133,23402,Dhaulagiri,Dhaulagiri-Mukut,Unclimbed,0,1,0,0,0,All,Unknown,Unknown,Unclimbed
JYAC,Jyachhung,Nepal & China,6338,20794,Api/Byas Risi/Guras,Far West-Kanjiroba,Unclimbed,1,0,0,0,0,All,Unknown,Unknown,Unclimbed
KABD,Kabru Dome,India only,6600,21654,Kangchenjunga/Simhalila,Kangchenjunga-Janak,Climbed,0,1,0,0,1982,Autumn,Sep 24,India,"Mahabir Thakur, Tshering Lobsang, K. N. Singh, Gautam Dutta, P. Bhotia, Umeshari Devi"
KABN,Kabru North,Nepal & India,7338,24075,Kangchenjunga/Simhalila,Kangchenjunga-Janak,Climbed,0,1,0,0,1935,Autumn,Nov 18,UK,C. R. (Reggie) Cooke
KABR,Kabru Main,Nepal & India,7412,24318,Kangchenjunga/Simhalila,Kangchenjunga-Janak,Climbed,1,0,0,0,1994,Spring,May 12,India,"Dan Singh, 2 unknown members"
KABS,Kabru South,Nepal & India,7318,24009,Kangchenjunga/Simhalila,Kangchenjunga-Janak,Climbed,1,0,0,0,1994,Spring,May 12,India,"S. P. Malik, N. Arshad, 11 members"
KAG1,Kagmara I,Nepal only,5978,19613,Kanjiroba,Far West-Kanjiroba,Climbed,1,0,0,0,1962,Spring,May 23,"UK, Nepal","Dorothea Gravina, Denise Evans, Nancy Smith, Pat Wood, Ang Temba Sherpa, Mingma Tsering Sherpa, Pemba Norbu Sherpa"
KAGA,Kanta Gaton,Nepal only,5910,19390,Kanjiroba,Far West-Kanjiroba,Climbed,1,0,0,0,2009,Summer,Aug 16,"France, Nepal","Jean-Rene Minelli, Abel Minelli, Eienne Minelli, Sarah Minelli, Pemba Jangbu Sherpa"
KAIP,Kaipuchonam,Nepal & China,6329,20764,Kanti/Palchung,Far West-Kanjiroba,Unclimbed,1,0,0,0,0,All,Unknown,Unknown,Unclimbed
KAKU,Kang Kuru,Nepal only,6344,20814,Mukut/Mustang,Dhaulagiri-Mukut,Climbed,0,1,0,0,2008,Spring,Apr 16,USA,"Peter Athans, Theodore Hessler"
KALI,Kali Himal,Nepal only,6985,22917,Khumbu,Khumbu-Rolwaling-Makalu,Climbed,1,0,0,0,1983,Spring,Apr 05,Netherlands,"Joost Ubblink, Edwin Van Nieuwkerk"
KAN1,Kande Hiunchuli North  I,Nepal only,6521,21394,Kanjiroba,Far West-Kanjiroba,Unclimbed,0,1,0,0,0,All,Unknown,Unknown,Unclimbed
KAN2,Kande Hiunchuli North  II,Nepal only,6471,21230,Kanjiroba,Far West-Kanjiroba,Climbed,0,1,0,0,1980,Spring,May 03,Switzerland,"Daniel Chevallier, Pierre Galland"
KANB,Kangbachen,Nepal only,7902,25925,Kangchenjunga/Simhalila,Kangchenjunga-Janak,Climbed,1,0,0,0,1974,Spring,May 26,Poland,"Wojciech Branski, Wieslaw Klaput, Marek Malatynski, Kazimierz Olech, Zbigniew Rubinowski"
KANC,Kangchenjunga Central,Nepal & India,8473,27799,Kangchenjunga/Simhalila,Kangchenjunga-Janak,Climbed,1,0,0,0,1978,Spring,May 22,Poland,"Wojciech Branski, Zygmunt Heinrich, Kazimierz Olech"
KAND,Kande Hiunchuli,Nepal only,6627,21742,Kanjiroba,Far West-Kanjiroba,Climbed,1,0,0,0,1972,Autumn,Oct 18,Japan,"Toyokazu Hirota, Shigeru Kuwahata"
KANG,Kangchenjunga,Nepal & India,8586,28169,Kangchenjunga/Simhalila,Kangchenjunga-Janak,Climbed,1,0,0,0,1955,Spring,May 25,UK,"George Band, Joe Brown"
KANN,Kangchenjunga North,Nepal & India,7938,26043,Kangchenjunga/Simhalila,Kangchenjunga-Janak,Unclimbed,1,0,0,0,0,All,Unknown,Unknown,Unclimbed?
KANS,Kangchenjunga South,Nepal & India,8476,27808,Kangchenjunga/Simhalila,Kangchenjunga-Janak,Climbed,1,0,0,0,1978,Spring,May 19,Poland,"Eugeniusz Chrobak, Wojciech Wroz"
KANT,Kanti Himal,Nepal & China,6850,22474,Kanti/Palchung,Far West-Kanjiroba,Climbed,1,0,0,0,2002,Autumn,Sep 24,"Japan, Nepal","Toyoji Wada, Katsumi Nishida, Atsushi Senda, Hyosuke Tsuboi, Yusuke Ueda, Ang Mingm Sherpa, Karchen Dawa Sherpa, Nga Dorje Sherpa"
KAPT,Kaptang,Nepal & China,5965,19570,Kanti/Palchung,Far West-Kanjiroba,Climbed,1,0,0,0,2009,Autumn,Jun 09,"Japan, Nepal","Tamotsu Ohnishi, Toshitsugi Irizawa, Gombu Sherpa"
KARK,Karko,Nepal only,6015,19734,Saipal,Far West-Kanjiroba,Unclimbed,1,0,0,0,0,All,Unknown,Unknown,Unclimbed?
KARS,Karsang Kang,Nepal only,6225,20423,Damodar,Annapurna-Damodar-Peri,Climbed,1,0,0,0,2008,Autumn,Oct 11,France,"Paulo Grobel, Mary Cler"
KARY,Karyolung,Nepal only,6530,21424,Rolwaling,Khumbu-Rolwaling-Makalu,Climbed,1,0,0,0,1982,Autumn,Oct 31,"Japan, Nepal","Yoshiyuki Inoue, Masatoshi Iwasa, Hiroshi Nishie, Yogendra Thapa, Gita Bdr Joshi, Babu Ram Pun, Gore Tamang, Pemba Tshering Sherpa"
KASI,Kasi Dalpha,Nepal only,6386,20951,Kanjiroba,Far West-Kanjiroba,Unclimbed,1,0,0,0,0,All,Unknown,Unknown,Unclimbed
KBNE,Kangbachen East,Nepal only,7780,25525,Kangchenjunga/Simhalila,Kangchenjunga-Janak,Unclimbed,1,0,0,0,0,All,Unknown,Unknown,Unclimbed
KBON,Konabon,Nepal only,6570,21555,Dhaulagiri,Dhaulagiri-Mukut,Unclimbed,1,0,0,0,0,All,Unknown,Unknown,Unclimbed
KCHN,Kangchung Nup,Nepal only,6043,19826,Khumbu,Khumbu-Rolwaling-Makalu,Climbed,0,1,0,0,1953,Spring,Apr 04,"UK, New Zealand","Edmund Hillary, Wilfred Noyce, Charles Wylie"
KCHS,Kangchung Shar,Nepal only,6063,19892,Khumbu,Khumbu-Rolwaling-Makalu,Climbed,1,0,0,0,1984,Autumn,Nov 01,Yugoslavia,Francek Knez
KGRI,Khangri Shar,Nepal only,6792,22283,Khumbu,Khumbu-Rolwaling-Makalu,Unclimbed,1,0,0,0,0,All,Unknown,Unknown,Unclimbed
KGRW,Khangri West,Nepal only,6658,21844,Khumbu,Khumbu-Rolwaling-Makalu,Unclimbed,1,0,0,0,0,All,Unknown,Unknown,Unclimbed
KGUR,Kang Guru,Nepal only,6981,22904,Peri,Annapurna-Damodar-Peri,Climbed,1,0,0,0,1955,Summer,Jul 02,W Germany,"Heinz Steinmetz, Fritz Lobbichler, Juergen Wellenkamp"
KHAM,Khamjung,Nepal only,6759,22175,Damodar,Annapurna-Damodar-Peri,Climbed,1,0,0,0,1982,All,Unknown,Japan,Climbed?
KHAT,Khatang,Nepal only,6790,22277,Rolwaling,Khumbu-Rolwaling-Makalu,Climbed,1,0,0,0,1982,Autumn,Oct 30,"Japan, Nepal","Tatsumi Kawamura, Yoshimi Kitayama, Dorje Sherpa"
KHAY,Khayang,Nepal & China,6186,20295,Manaslu/Mansiri,Manaslu-Ganesh,Unclimbed,1,0,0,0,0,All,Unknown,Unknown,Unclimbed?
KHNG,Khung,Nepal & China,6024,19764,Kanti/Palchung,Far West-Kanjiroba,Unclimbed,1,0,0,0,0,All,Unknown,Unknown,Unclimbed
KHON,Khongma Tse,Nepal only,5798,19022,Khumbu,Khumbu-Rolwaling-Makalu,Climbed,0,0,1,1978,0,All,Unknown,Unknown,1st ascent unknown
KHUM,Khumbutse,Nepal & China,6639,21781,Khumbu,Khumbu-Rolwaling-Makalu,Unclimbed,1,0,0,0,0,All,Unknown,Unknown,Unclimbed
KIMS,Kimshung,Nepal only,6781,22247,Langtang,Langtang-Jugal,Unclimbed,0,1,0,0,0,All,Unknown,Unknown,Unknown
KIRA,Kirat Chuli,Nepal & India,7362,24154,Jongsang,Kangchenjunga-Janak,Climbed,1,0,0,0,1939,Summer,May 29,"Switzerland, Germany","Ernst Grob, Herbert Paidar, Ludwig Schmaderer"
KJER,Kanjeralwa,Nepal only,6612,21693,Kanjiroba,Far West-Kanjiroba,Climbed,1,0,0,0,1973,Spring,Apr 22,"Japan, Nepal","Yasuaki Goshima, Koichi Kyogoku, Mingma Tensing Sherpa, Mingma Tsering Sherpa"
KJRN,Kanjiroba North,Nepal only,6858,22500,Kanjiroba,Far West-Kanjiroba,Unclimbed,1,0,0,0,0,All,Unknown,Unknown,Unclimbed
KJRS,Kanjiroba South,Nepal only,6883,22582,Kanjiroba,Far West-Kanjiroba,Climbed,1,0,0,0,1970,Autumn,Nov 07,Japan,"Hiroshi Okuda, Ichiryo Sato, Munehiro Sawada"
KNAG,Kang Nagchugo,Nepal & China,6737,22103,Rolwaling,Khumbu-Rolwaling-Makalu,Climbed,1,0,0,0,2008,Autumn,Oct 17,USA,"Joseph Puryear, David Gottlieb"
KNTE,Kanti Himal East,Nepal & China,6516,21378,Kanti/Palchung,Far West-Kanjiroba,Unclimbed,1,0,0,0,0,All,Unknown,Unknown,Unclimbed
KOGI,Kogi Khang North,Nepal & China,6275,20587,Kanti/Palchung,Far West-Kanjiroba,Unclimbed,1,0,0,0,0,All,Unknown,Unknown,Unclimbed
KOJI,Kojichuwa Chuli,Nepal & China,6439,21125,Kanti/Palchung,Far West-Kanjiroba,Climbed,1,0,0,0,2010,Spring,May 25,Japan,"Ken Fujikawa, Yuta Kawamura, Satoshi Kimoto"
KOJS,Kojichuwa South,Nepal & China,6264,20551,Kanti/Palchung,Far West-Kanjiroba,Unclimbed,1,0,0,0,0,All,Unknown,Unknown,Unclimbed
KOTA,Kotang,Nepal & India,6148,20171,Kangchenjunga/Simhalila,Kangchenjunga-Janak,Climbed,1,0,0,0,1982,Autumn,Oct 11,Inida,"K. V. Cherian, Nima Tashi Sherpa, Ang Norbu, Ki Kami Sherpa"
KTEG,Kangtega,Nepal only,6783,22254,Khumbu,Khumbu-Rolwaling-Makalu,Climbed,1,0,0,0,1963,Spring,Jun 05,"New Zealand, USA","David Dornan, Tom Frost, Michael Gill, Jim Wilson"
KTOK,Kangtokal,Nepal only,6294,20650,Dhaulagiri,Dhaulagiri-Mukut,Climbed,1,0,0,0,1962,Spring,Jun 06,"Japan, Nepal","Zenkichi Hirayama, Ang Temba Sherpa"
KTSU,Kangtsune,Nepal only,6444,21142,Kanjiroba,Far West-Kanjiroba,Unclimbed,0,1,0,0,0,All,Unknown,Unknown,Unclimbed
KTUN,Khatung Khang,Nepal only,6484,21273,Annapurna,Annapurna-Damodar-Peri,Climbed,1,0,0,0,1956,Spring,Apr 12,Switzerland,"Arthur Baumgartner, Marguerite Deriaz"
KUML,Kumlung,Nepal only,6355,20850,Damodar,Annapurna-Damodar-Peri,Climbed,1,0,0,0,2008,Autumn,Oct 14,France,"Paulo Grobel, Paul Vulin"
KUSU,Kusum Kanguru,Nepal only,6370,20899,Khumbu,Khumbu-Rolwaling-Makalu,Climbed,0,0,1,1978,1981,Autumn,Oct 07,New Zealand,Bill Denz
KWAN,Kwangde,Nepal only,6186,20295,Rolwaling,Khumbu-Rolwaling-Makalu,Climbed,0,0,1,1978,1978,Autumn,Nov 11,Japan,"Takashi Iwahashi, Yoshihisa Ishikawa, Seiji Ogawa"
KYAB,Kyabura,Nepal only,6294,20650,Kangchenjunga/Simhalila,Kangchenjunga-Janak,Unclimbed,1,0,0,0,0,All,Unknown,Unknown,Unclimbed?
KYAS,Kyashar,Nepal only,6770,22211,Khumbu,Khumbu-Rolwaling-Makalu,Climbed,1,0,0,0,2003,Autumn,Oct 18,"UK, Austria, Swiss","Bruce Normand, Sam Broderick, Andreas Frank"
KYAZ,Kyazo Ri,Nepal only,6151,20180,Khumbu,Khumbu-Rolwaling-Makalu,Climbed,0,0,1,2002,2002,Autumn,Oct 20,"UK, France","Duncan Wilson, Vincent Marche"
KYR1,Kyungka Ri 1,Nepal only,6599,21650,Langtang,Langtang-Jugal,Climbed,1,0,0,0,2017,Autumn,Oc 15,S Korea,"Han San-Hum, Oh Chi-Wan"
KYR2,Kyungka Ri 2,Nepal & China,6506,21345,Langtang,Langtang-Jugal,Unclimbed,1,0,0,0,0,All,Unknown,Unknown,Unclimbed
LAMJ,Lamjung Himal,Nepal only,6983,22910,Annapurna,Annapurna-Damodar-Peri,Climbed,1,0,0,0,1974,Spring,Apr 25,UK,"Derrick Chamberlain, Phillip Neame"
LAMP,Lampo,Nepal & China,6648,21811,Ganesh/Shringi,Manaslu-Ganesh,Unclimbed,0,1,0,0,0,All,Unknown,Unknown,Unclimbed
LANG,Langtang Lirung,Nepal only,7227,23711,Langtang,Langtang-Jugal,Climbed,1,0,0,0,1978,Autumn,Oct 24,"Japan, Nepal","Seishi Wada, Pemba Tsering Sherpa"
LANR,Langtang Ri,Nepal & China,7205,23638,Langtang,Langtang-Jugal,Climbed,1,0,0,0,1981,Autumn,Oct 10,"Japan, Nepal","Soichi Nasu, Makihiro Wakao, Noboru Yamada, Ang Rinji Sherpa"
LANY,Langtang Yubra,Nepal only,6048,19843,Langtang,Langtang-Jugal,Unclimbed,0,0,1,0,2018,Autumn,Oct 21,"Australia, Netherands, Nepal","Karen De Lathouder, Elizabeth Finden, Edith Jankowski, Chris Jones, Warren Townsden, Lhakpa Nuru Sherpa, Mingma Sherpa, Nawang Sherpa, Phurba Sherpa, Sona Sherpa"
LARK,Larkya Peak,Nepal only,6416,21050,Manaslu/Mansiri,Manaslu-Ganesh,Climbed,0,0,1,0,2017,Autumn,Sep 27,Georgia,"Archil Badriashvili, Giorgi Tepnadze, Bakar Gelashvili"
LAS2,Lashar II,Nepal & China,6803,22320,Janak/Ohmi Kangri,Kangchenjunga-Janak,Unclimbed,1,0,0,0,0,All,Unknown,Unknown,Unclimbed
LASA,Lasa,Nepal & China,6189,20305,Api/Byas Risi/Guras,Far West-Kanjiroba,Unclimbed,1,0,0,0,0,All,Unknown,Unknown,Unclimbed
LASH,Lashar I,Nepal & China,6842,22448,Janak/Ohmi Kangri,Kangchenjunga-Janak,Climbed,1,0,0,0,2005,Autumn,Oct 12,Slovenia,"Andrej Stremfelj, Miha Habjan"
LCHA,Lachama Chuli,Nepal & China,6721,22051,Nalakankar/Chandi/Changla,Far West-Kanjiroba,Climbed,1,0,0,0,2007,Autumn,Sep 14,Japan,"Atsushi Senda, Ryouta Fujii, Keizou Ishikawa, Hiroshi Kobayashi, Kouhei Kotani, Naoki Shimozato, Yuhki Tani"
LCHN,Lachama North,Nepal & China,6628,21745,Nalakankar/Chandi/Changla,Far West-Kanjiroba,Unclimbed,1,0,0,0,0,All,Unknown,Unknown,Unclimbed
LDAK,Langdak,Nepal only,6220,20407,Rolwaling,Khumbu-Rolwaling-Makalu,Climbed,1,0,0,0,2015,Autumn,Oct 05,Nepal,"Dawa Gyalje Sherpa, Nima Tenji Sherpa, Tashi Sherpa"
LDNG,Langdung,Nepal & China,6326,20755,Rolwaling,Khumbu-Rolwaling-Makalu,Climbed,1,0,0,0,2017,Winter,Dec 20,Nepal,"Nima Tenji Sherpa, Dawa Gyalje Sherpa, Dawa Yangzum Sherpa, Pasang Kitar Sherpa"
LEOE,Leonpo Gang East,Nepal & China,6733,22090,Jugal,Langtang-Jugal,Climbed,1,0,0,0,1955,Spring,May 11,"UK, Nepal","Monica Jackson, Elizabeth Stark, Mingma Gyalgen Sherpa, Ang Temba Sherpa"
LEON,Leonpo Gang,Nepal & China,6979,22897,Jugal,Langtang-Jugal,Climbed,1,0,0,0,1962,Spring,May 03,Japan,"Tadashi Morita, Kazunari Yasuhisa"
LHAS,Lha Shamma,Nepal only,6412,21037,Kanjiroba,Far West-Kanjiroba,Climbed,1,0,0,0,1962,Spring,May 14,"UK, Nepal","Josephine Scarr, Barbara Spark, Mingma Tsering Sherpa, Pemba Norbu Sherpa"
LHAY,Lhayul Peak,Nepal only,6395,20981,Api/Byas Risi/Guras,Far West-Kanjiroba,Unclimbed,1,0,0,0,0,All,Unknown,Unknown,Unclimbed
LHOM,Lhotse Middle,Nepal & China,8410,27592,Khumbu,Khumbu-Rolwaling-Makalu,Climbed,1,0,0,0,2001,Spring,May 23,Russia,"Sergei Timofeev, Alexei Bolotov, Piotr Kouznetsov, Evgeni Vinogradski"
LHOT,Lhotse,Nepal & China,8516,27940,Khumbu,Khumbu-Rolwaling-Makalu,Climbed,1,0,0,0,1956,Spring,May 18,Switzerland,"Fritz Luchsinger, Ernst Reiss"
LIK1,Linkhu Chuli Shar,Nepal only,6719,22044,Rolwaling,Khumbu-Rolwaling-Makalu,Climbed,1,0,0,0,2013,Autumn,Nov 13,Germany,Ines Papert
LIK2,Linkhu Chuli Nup,Nepal only,6659,21847,Rolwaling,Khumbu-Rolwaling-Makalu,Climbed,1,0,0,0,1960,Autumn,Oct 21,"France, Nepal","Alain Barbezat, Cecile Barbezat, Nawang Dorje Sherpa"
LING,Lingtren,Nepal & China,6713,22024,Khumbu,Khumbu-Rolwaling-Makalu,Climbed,1,0,0,0,1935,Summer,Aug,UK,"Eric Shipton, Dan Bryant"
LMOC,Langmoche Ri,Nepal only,6552,21496,Rolwaling,Khumbu-Rolwaling-Makalu,Climbed,1,0,0,0,2012,Autumn,Nov 17,USA,"Roberto Villanueva, Alan Rousseau"
LNAK,Lhonak,Nepal only,6070,19915,Janak/Ohmi Kangri,Kangchenjunga-Janak,Unclimbed,1,0,0,0,0,All,Unknown,Unknown,Unclimbed
LNGK,Langchung Khang,Nepal & China,6786,22264,Jongsang,Kangchenjunga-Janak,Unclimbed,1,0,0,0,0,All,Unknown,Unknown,Unclimbed?
LNJU,Langju,Nepal only,6426,21083,Ganesh/Shringi,Manaslu-Ganesh,Climbed,1,0,0,0,2017,Autumn,Oct 17,Japan,"Norifumi Fukuda, Kojuro Hagihara, Yudai Suzuki"
LNKE,Lunchhung Kamo East,Nepal only,6024,19764,Kanti/Palchung,Far West-Kanjiroba,Climbed,0,1,0,0,1999,Summer,Jul 09,"Japan, Nepal","Tamotsu Ohnishi, Takehiko Yanagihara, Chuldim Nuru Sherpa, Kancha Dawa Sherpa"
LNPO,Langpo,Nepal & India,6965,22851,Jongsang,Kangchenjunga-Janak,Climbed,1,0,0,0,1909,Autumn,Sep 14,UK,A. M. Kellas
LOBE,Lobuje East,Nepal only,6090,19980,Khumbu,Khumbu-Rolwaling-Makalu,Climbed,0,0,1,1978,1984,Spring,Apr 25,"USA, Nepal","Larry Nielson, Any Gyaltsen Sherpa"
LOBW,Lobuje West,Nepal only,6135,20128,Khumbu,Khumbu-Rolwaling-Makalu,Climbed,0,0,1,2002,1984,Autumn,Sep 28,Japan,"Yuji Kawakura, Yoshihiro Taguchi"
LSAM,Lungsampa,Nepal only,6500,21325,Khumbu,Khumbu-Rolwaling-Makalu,Climbed,1,0,0,0,2014,All,Unknown,Spain,"Jordi Corominas, Jordi Tosas"
LSHR,Lhotse Shar,Nepal & China,8382,27500,Khumbu,Khumbu-Rolwaling-Makalu,Climbed,1,0,0,0,1970,Spring,May 12,Austria,"Josef Mayerl, Rolf Walter"
LSIS,Langshisa Ri,Nepal only,6412,21037,Jugal,Langtang-Jugal,Climbed,0,0,1,2002,1982,Spring,Apr 23,"Japan, Nepal","Takuya Kajimoto, Pasang Norbu Sherpa"
LUGU,Lugula,Nepal & China,6899,22635,Damodar,Annapurna-Damodar-Peri,Climbed,1,0,0,0,2010,Autumn,Nov 02,France,Renald Guillaune
LUN2,Lunag II,Nepal only,6812,22349,Rolwaling,Khumbu-Rolwaling-Makalu,Climbed,0,1,0,0,2010,Autumn,Oct 26,France,"Mathieu Detrie, Max Belleville, Mathiew Maynadier, Sebastien Ratel"
LUNG,Lungchhung,Nepal & China,6043,19826,Kanti/Palchung,Far West-Kanjiroba,Unclimbed,1,0,0,0,0,All,Unknown,Unknown,Unclimbed
LUNR,Lunag Ri,Nepal & China,6895,22621,Rolwaling,Khumbu-Rolwaling-Makalu,Unclimbed,0,1,0,0,0,All,Unknown,Unknown,Unknown
LUNW,Lunag West,Nepal & China,6492,21299,Rolwaling,Khumbu-Rolwaling-Makalu,Climbed,0,1,0,0,2013,Autumn,Oct 22,USA,"Scott Adamson, Chris Wright"
MACH,Machhapuchhare,Nepal only,6993,22943,Annapurna,Annapurna-Damodar-Peri,Unclimbed,0,1,0,0,0,All,Unknown,Unknown,Unclimbed
MAK2,Makalu II,Nepal & China,7678,25190,Makalu,Khumbu-Rolwaling-Makalu,Climbed,1,0,0,0,1954,Autumn,Oct 22,"UK, Nepal","Jean Franco, Lionel Terray, Gyaltsen Norbu Sherpa, Pa Norbu Sherpa"
MAKA,Makalu,Nepal & China,8485,27838,Makalu,Khumbu-Rolwaling-Makalu,Climbed,1,0,0,0,1955,Spring,May 15,France,"Jean Couzy, Lionel Terray"
MALA,Malanphulan,Nepal only,6573,21565,Khumbu,Khumbu-Rolwaling-Makalu,Climbed,1,0,0,0,2000,Spring,Apr 28,USA,"Peter Carse, Amy Bullard"
MANA,Manaslu,Nepal only,8163,26781,Manaslu/Mansiri,Manaslu-Ganesh,Climbed,1,0,0,0,1956,Spring,May 09,"Japan, Nepal","Toshio Imanishi, Gyaltsen Norbu Sherpa"
MANN,Manaslu North,Nepal only,6994,22946,Manaslu/Mansiri,Manaslu-Ganesh,Climbed,1,0,0,0,1964,Autumn,Oct 25,"Netherlands, Austria, Nepal","Alfons Driessen, Jan De Lint, Hubert Schriebl, Ila Tshering Sherpa, Nima Tenzing Sherpa"
MANP,Manapathi,Nepal only,6380,20932,Dhaulagiri,Dhaulagiri-Mukut,Climbed,1,0,0,0,1956,Spring,Apr 25,"Argentina, Nepal","Emiliano Huerta, Ayiwa Sherpa"
MARD,Mardi Himal,Nepal only,5553,18219,Annapurna,Annapurna-Damodar-Peri,Climbed,0,0,1,1978,1962,Spring,Apr 23,"UK, Nepal","J. O. M. Roberts, Ang Tshering Sherpa, Tenzing Nindra Sherpa"
MARI,Mariyang,Nepal & China,6528,21417,Kanti/Palchung,Far West-Kanjiroba,Unclimbed,1,0,0,0,0,All,Unknown,Unknown,Unclimbed
MARW,Mariyang West,Nepal & China,6455,21178,Kanti/Palchung,Far West-Kanjiroba,Unclimbed,1,0,0,0,0,All,Unknown,Unknown,Unclimbed
MATA,Matathumba,Nepal only,5767,18921,Kanjiroba,Far West-Kanjiroba,Climbed,0,1,0,0,1961,Spring,May 16,"UK, Nepal","John Tyson, James Burnet, John Earle, Mingma Tsering, Ang Temba Sherpa"
MAYT,Mayonthang Kang,Nepal & China,6449,21158,Kanti/Palchung,Far West-Kanjiroba,Unclimbed,1,0,0,0,0,All,Unknown,Unknown,Unclimbed
MERA,Mera Peak,Nepal only,6470,21227,Khumbu,Khumbu-Rolwaling-Makalu,Climbed,0,0,1,1978,1953,Spring,May,"UK, Nepal","J. O. M. Roberts, Sen Tenzing Sherpa"
MERR,Merra,Nepal only,6334,20781,Kangchenjunga/Simhalila,Kangchenjunga-Janak,Climbed,1,0,0,0,2006,Autumn,Oct 18,Denmark,Claus Ostergaard
MERS,Mera South,Nepal only,6064,19895,Khumbu,Khumbu-Rolwaling-Makalu,Unclimbed,1,0,0,0,0,All,Unknown,Unknown,Unclimbed?
MING,Mingbo Ri,Nepal only,6207,20364,Khumbu,Khumbu-Rolwaling-Makalu,Unclimbed,0,1,0,0,0,All,Unknown,Unknown,Unclimbed
MNSL,Mansail,Nepal only,6235,20456,Mukut/Mustang,Dhaulagiri-Mukut,Climbed,1,0,0,0,2014,Autumn,Sep 29,Japan,"Yukiko Inoue, Eri Hasegawa, Mariko Nakamura, Kei Taniguchi"
MNSS,Mansail South,Nepal only,6248,20499,Mukut/Mustang,Dhaulagiri-Mukut,Unclimbed,1,0,0,0,0,All,Unknown,Unknown,Unclimbed
MOJC,Mojca,Nepal only,6024,19764,Kangchenjunga/Simhalila,Kangchenjunga-Janak,Climbed,1,0,0,0,1974,Autumn,Oct 11,Yugoslavia,"Stane Belak, Danilo Cedilnik"
MPNW,Manapathi NW,Nepal only,6384,20945,Dhaulagiri,Dhaulagiri-Mukut,Climbed,0,1,0,0,1977,Spring,Apr 20,"Italy, UK, W Germany","Reinhold Messner, Leo Dickinson, Eric Jones, Otto Wiedemann"
MUKT,Mukut Himal,Nepal only,6087,19970,Mukut/Mustang,Dhaulagiri-Mukut,Climbed,1,0,0,0,1967,Autumn,Sep,Netherlands,"Alfons J. Driessen, Michiel van Mourik Broekman"
MUPK,Mustang Peak,Nepal only,6229,20436,Mukut/Mustang,Dhaulagiri-Mukut,Climbed,0,1,0,0,2001,Autumn,Oct 07,"Japan, Nepal","Tomatsu Ohnishi, Koji Mizutani, Takehiko Yanagihara, Katsuhiko Asahi, Mingma Nuru Sherpa, Chuldin Nuru Sherpa, Kancha Dawa Sherpa"
MUST,Mustang Himal,Nepal only,6195,20325,Mukut/Mustang,Dhaulagiri-Mukut,Climbed,1,0,0,0,2014,Autumn,Nov 02,USA,"Melissa Arnot, Ben Jones, Jon Mancuso"
MYAG,Myagdi Matha,Nepal only,6273,20581,Dhaulagiri,Dhaulagiri-Mukut,Unclimbed,0,1,0,0,0,All,Unknown,Unknown,Unclimbed?
NAG1,Nangpai Gosum I,Nepal & China,7321,24019,Khumbu,Khumbu-Rolwaling-Makalu,Climbed,1,0,0,0,2017,Autumn,Oct 03,Germany,Jost Kobusch
NAG2,Nangpai Gosum II,Nepal & China,7287,23907,Khumbu,Khumbu-Rolwaling-Makalu,Unclimbed,1,0,0,0,0,All,Unknown,Unknown,Unclimbed
NALA,Nalakankar North,Nepal & China,6062,19888,Nalakankar/Chandi/Changla,Far West-Kanjiroba,Climbed,1,0,0,0,2000,Summer,Jul 06,"Japan, Nepal","Takehiko Yanagihara, Ang Phurba Sherpa"
NALS,Nalakankar South,Nepal & China,6024,19764,Nalakankar/Chandi/Changla,Far West-Kanjiroba,Climbed,0,1,0,0,2000,Summer,Jul 07,"Japan, Nepal","Tamotsu Ohnishi, Takehiko Yanagihara, Chuldim Nuru Sherpa, Kancha Dawa Sherpa"
NAM2,Nampa II,Nepal only,6585,21604,Api/Byas Risi/Guras,Far West-Kanjiroba,Unclimbed,1,0,0,0,0,All,Unknown,Unknown,Unclimbed
NAM3,Nampa III,Nepal only,6611,21690,Api/Byas Risi/Guras,Far West-Kanjiroba,Unclimbed,1,0,0,0,0,All,Unknown,Unknown,Unclimbed
NAMP,Nampa,Nepal only,6729,22077,Api/Byas Risi/Guras,Far West-Kanjiroba,Climbed,1,0,0,0,1972,Spring,May 05,Japan,"Fukutoshi Kimura, Susumu Takahashi"
NAMS,Nampa South,Nepal only,6130,20112,Api/Byas Risi/Guras,Far West-Kanjiroba,Unclimbed,1,0,0,0,0,All,Unknown,Unknown,Unclimbed?
NAN2,Nangamari II,Nepal only,6209,20371,Janak/Ohmi Kangri,Kangchenjunga-Janak,Climbed,1,0,0,0,2016,Autumn,Oct 17,Japan,"Tsuneo Shigehiro, Kensuke Iwai, Kiyo Kuroda, Shiro Matsunaka, Yusuke Morimoto, Kanji Totegi, Miyoko Nagase, Masayuki Takenaka, Saori Tatsuno"
NANG,Nangamari I,Nepal & China,6547,21480,Janak/Ohmi Kangri,Kangchenjunga-Janak,Climbed,1,0,0,0,2010,Autumn,Nov 05,Australia,"Timothy Macartney-Snape, David Barton"
NAUL,Naulekh,Nepal only,6340,20801,Khumbu,Khumbu-Rolwaling-Makalu,Climbed,1,0,0,0,1954,Spring,Jun 08,New Zealand,"Colin Todd, Bill Beaven"
NAYA,Naya Kanga,Nepal only,5863,19236,Jugal,Langtang-Jugal,Climbed,0,0,1,1978,0,All,Unknown,Unknown,1st ascent unknown
NCHU,Nupchu,Nepal only,6172,20249,Janak/Ohmi Kangri,Kangchenjunga-Janak,Climbed,0,1,0,0,1962,Spring,May 20,Japan,"Takayuki Tsubaki, Chotare Sherpa"
NEMJ,Nemjung,Nepal only,7140,23425,Peri,Annapurna-Damodar-Peri,Climbed,1,0,0,0,1983,Spring,Oct 27,"Japan, Nepal","Makito Minami, Wataru Saito, Ken Takahashi, Kirki Lama"
NEPA,Nepal Peak,Nepal & India,7177,23547,Jongsang,Kangchenjunga-Janak,Climbed,1,0,0,0,1930,Spring,May 24,Austria,Erwin Schneider
NGAP,Nepal Gap Peak,Nepal & India,7007,22989,Kangchenjunga/Simhalila,Kangchenjunga-Janak,Unclimbed,1,0,0,0,0,All,Unknown,Unknown,Unclimbed?
NGO2,Ngojumba Kang II,Nepal & China,7743,25404,Khumbu,Khumbu-Rolwaling-Makalu,Climbed,1,0,0,0,1965,Spring,Apr 24,"Japan, Nepal","Naomi Uemura, Pemba Tenzing Sherpa"
NGO3,Ngojumba Kang III,Nepal & China,7681,25200,Khumbu,Khumbu-Rolwaling-Makalu,Unclimbed,1,0,0,0,0,All,Unknown,Unknown,Unclimbed
NGOJ,Ngojumba Kang I,Nepal & China,7916,25971,Khumbu,Khumbu-Rolwaling-Makalu,Climbed,1,0,0,0,1982,Autumn,Nov 02,"S Korea, Nepal","Kim Young-Han, Ang Tshering Sherpa, Dorje Sherpa"
NGOR,Nagoru,Nepal only,6165,20226,Peri,Annapurna-Damodar-Peri,Climbed,0,1,0,0,2016,Autumn,Oct 21,"Austria, Nepal","Wolfgang Drexler, Lawang Tamang"
NILC,Nilgiri Central,Nepal only,6940,22769,Annapurna,Annapurna-Damodar-Peri,Climbed,1,0,0,0,1979,Spring,Apr 30,Japan,"Kohichi Sakata, Yasuo Tsuda"
NILN,Nilgiri North,Nepal only,7061,23166,Annapurna,Annapurna-Damodar-Peri,Climbed,1,0,0,0,1962,Autumn,Oct 19,"Netherlands, France, Nepal","Lionel Terray, H. G. Van Lookern Campagne, P. Van Lookern Campagne, P. F. J. Van Lookern Campagne, Wangdi Sherpa"
NILS,Nilgiri South,Nepal only,6839,22438,Annapurna,Annapurna-Damodar-Peri,Climbed,1,0,0,0,1978,Autumn,Oct 10,Japan,"Kazuo Mitsui, Taichi Fujimatsu, Yoshiaki Kato, Nobuhito Morota, Seiji Tanaka, Hideki Yoshida"
NORB,Norbu Kang,Nepal only,6085,19964,Kanjiroba,Far West-Kanjiroba,Climbed,1,0,0,0,2003,Summer,Jun 25,"Japan, Nepal","Tamotsu Ohnishi, Tazuko Inoue, Koji Mizutani, Takehiro Yanigahara, Chuldim Nuru Sherpa, Kancha Dawa Sherpa"
NPHU,Narphu,Nepal only,5921,19426,Damodar,Annapurna-Damodar-Peri,Climbed,1,0,0,0,2014,Autumn,Nov 22,"UK, Nepal","Brian Jackson, Heather Bentley, Catherine Husted, Dawn Richardson, James Salt, Rhiannon Thomson, Mingma Dorje Sherpa, Pasang Sherpa Shikhar Pandey"
NREK,Nirekha,Nepal only,6159,20207,Khumbu,Khumbu-Rolwaling-Makalu,Climbed,0,0,1,2002,0,All,Unknown,Unknown,1st ascent unknown
NUMB,Numbur,Nepal only,6958,22828,Rolwaling,Khumbu-Rolwaling-Makalu,Climbed,1,0,0,0,1963,Spring,May 29,"Japan, Nepal","Hiroshi Matsuo, Mingma Tsering Sherpa"
NUMR,Numri,Nepal only,6635,21768,Khumbu,Khumbu-Rolwaling-Makalu,Climbed,1,0,0,0,2002,Autumn,Nov 07,Germany,"Olaf Rieck, Carsten Schmidt, Lydia Schubert"
NUPE,Nuptse East I,Nepal only,7795,25574,Khumbu,Khumbu-Rolwaling-Makalu,Climbed,1,0,0,0,2003,Autumn,Nov 02,Russia,"Valeri Babanov, Yuri Kochelenko"
NUPK,Nupche Kang,Nepal & China,6576,21575,Khumbu,Khumbu-Rolwaling-Makalu,Climbed,1,0,0,0,1964,Spring,Apr 06,"W Germany, Nepal","Fritz Stammberger, Aila Sherpa"
NUPL,Nup La Kang,Nepal & China,6861,22510,Khumbu,Khumbu-Rolwaling-Makalu,Climbed,1,0,0,0,2018,Autumn,Nov 02,"USA, Norway",Unknown
NUPT,Nuptse,Nepal only,7864,25801,Khumbu,Khumbu-Rolwaling-Makalu,Climbed,1,0,0,0,1961,Spring,May 16,"UK, Nepal","Dennis Davis, Tashi Sherpa"
OHMI,Ohmi Kangri,Nepal & China,6839,22438,Janak/Ohmi Kangri,Kangchenjunga-Janak,Climbed,1,0,0,0,1985,Spring,Apr 14,Switzerland,"Andre Rieder, Alain Vaucher"
OMBG,Ombigaichen,Nepal only,6340,20801,Khumbu,Khumbu-Rolwaling-Makalu,Climbed,0,0,1,2002,1960,Autumn,Nov 18,"New Zealand, Nepal","Jim Milledge, Ang Tsering Sherpa"
OMBK,Ombak Himal,China only,6300,20669,Janak/Ohmi Kangri,Kangchenjunga-Janak,Unclimbed,0,1,0,0,0,All,Unknown,Unknown,Unclimbed?
OMIT,Omitso Go,Nepal & China,6332,20774,Rolwaling,Khumbu-Rolwaling-Makalu,Unclimbed,1,0,0,0,0,All,Unknown,Unknown,Unclimbed
PALD,Paldor,Nepal only,5903,19367,Ganesh/Shringi,Manaslu-Ganesh,Climbed,0,0,1,1978,1949,Summer,Unknown,"UK, Nepal","H. W. Tilman, Peter Lloyd, Tenzing Sherpa, Da Namgyal Sherpa"
PAMA,Pama Himal,Nepal & China,6300,20669,Ganesh/Shringi,Manaslu-Ganesh,Unclimbed,1,0,0,0,0,All,Unknown,Unknown,Unclimbed
PAN1,Panpoche 1,Nepal only,6620,21719,Manaslu/Mansiri,Manaslu-Ganesh,Climbed,1,0,0,0,2019,Autumn,Oct 03,Georgia,"Archil Badriashvi, Bakari Gelashvili, Giorgi Tepnadze"
